{"intent":"read","release_verdict":"fail","executive_summary":"All 87 catalogue rows were audited from the attached evidence. The deterministic local build, contracts, feature validator, smoke suite, and local browser checks passed, but they do not disprove the high-confidence production finding that a provider labeled Verification in progress can expose session selection, Request to book, and card checkout. That contradiction is a release stop: feature 27 is downgraded to blocked at 4/10 and feature 32 to blocked at 3/10. The current Getting Started and audit changes are also explicitly unreleased and lack production verification.","deterministic_checks":[{"name":"build","status":"pass","evidence":"Attached latest-evidence record: python3 src/build.py passed at 2026-08-29T18:18:00Z; 17 modules, 3 font faces, 17 AA-verified sport-color pages, 19 CSP hashes, build stamp 713146f29c7f37a6."},{"name":"AI contract","status":"pass","evidence":"Attached latest-evidence record: node scripts/ai-contract-test.mjs passed 34 assertions at 2026-08-29T18:18:00Z."},{"name":"Codex council contract","status":"pass","evidence":"Attached latest-evidence record: python3 scripts/codex-agent-contract-test.py passed at 2026-08-29T18:18:00Z with one lead and 15 read-only specialists."},{"name":"repository contract","status":"pass","evidence":"Attached latest-evidence record: node scripts/repo-contract-test.mjs passed 64 assertions at 2026-08-29T18:18:00Z."},{"name":"data contract","status":"pass","evidence":"Attached latest-evidence record: node scripts/data-contract-test.mjs passed 17 assertions at 2026-08-29T18:18:00Z."},{"name":"Getting Started contract","status":"pass","evidence":"Attached latest-evidence record: node scripts/getting-started-contract-test.mjs passed at 2026-08-29T18:18:00Z, covering seven evidence-derived steps, three phases, drawer behavior, focus restoration, and 44px mobile actions."},{"name":"87-feature evidence validator","status":"pass","evidence":"Attached latest-evidence record: python3 scripts/sporv-feature-eval.py passed at 2026-08-29T18:18:00Z with 87 ordered features, no validation errors, and catalogue baseline 3.68/10."},{"name":"full elevated browser smoke","status":"pass","evidence":"Attached latest-evidence record: bash src/smoke.sh passed at 2026-08-29T18:19:00Z across 13 visitor routes, 16 coach tabs, live catalogue data, CSP, auth, booking, trust, persistence, accessibility, and product assertions; four known family contrast findings and ten legacy thin blocks remained warnings."},{"name":"manual local Getting Started browser check","status":"pass","evidence":"Attached manual-browser record at http://127.0.0.1:4175/?live=0 reports three phases, seven actions, evidence-derived completion, one white header action, 390px overflow safety, 44px actions, drawer isolation, focus restoration, and preserved auth destination."},{"name":"production trust-path assertion","status":"fail","evidence":"Independent production review at 2026-08-29T18:05:00Z found Apex Performance Club labeled Verification in progress while an enabled session selector, Request to book, and Check out with a card were exposed."},{"name":"current-change production deployment verification","status":"blocked","evidence":"Attached production record says current_change_deployed=false; live remains commit 861e0d903c2dda59f716742e9255c45d8505fe68 with build stamp 6b640a511b402e48, while local build stamp is 713146f29c7f37a6."}],"feature_ratings":[{"id":1,"feature":"Gym finder","domain":"AI Assistant","classification":"implemented_unverified","score":5,"evidence":["src/sporve-web.host.html#facilitiesCardHTML","docs/feature-audit-2026-08-24.md#gym-finder"],"blocker":"The live coach-command deployment, Places secret, enrichment table, and inquiry lifecycle were not reverified.","confidence":"medium"},{"id":2,"feature":"Gym scheduling","domain":"AI Assistant","classification":"spec_only","score":2,"evidence":["docs/feature-audit-2026-08-24.md#gym-scheduling","docs/coach-portal-spec.md#scheduling-capacity"],"blocker":"A facility is not a live schedulable resource and there is no rental-status writer.","confidence":"high"},{"id":3,"feature":"AI emailing","domain":"AI Assistant","classification":"absent","score":1,"evidence":["docs/feature-audit-2026-08-24.md#ai-emailing"],"blocker":"There is no send_email tool or verified email-delivery provider.","confidence":"high"},{"id":4,"feature":"AI in-app message sending","domain":"AI Assistant","classification":"implemented_unverified","score":6,"evidence":["src/mod-coachaccount.js#sendParentMessage","docs/feature-audit-2026-08-24.md#ai-in-app-message-sending"],"blocker":"Only the one-parent path is real on web; inbox hydration and bulk dispatch remain incomplete.","confidence":"medium"},{"id":5,"feature":"AI notes","domain":"AI Assistant","classification":"implemented_unverified","score":5,"evidence":["src/mod-notes.js","docs/feature-audit-2026-08-24.md#ai-notes","docs/red-drafts/2026-08-25-attendance-migration.md"],"blocker":"The web implementation is local and the sibling note and attendance deploy state is unverified.","confidence":"medium"},{"id":6,"feature":"AI drafting suite","domain":"AI Assistant","classification":"implemented_unverified","score":7,"evidence":["src/smoke.sh#assistant-dispatch","docs/feature-audit-2026-08-24.md#ai-drafting-suite"],"blocker":"Bulk, broadcast, and recurring campaign execution are not complete.","confidence":"medium"},{"id":7,"feature":"AI operations Q&A","domain":"AI Assistant","classification":"implemented_unverified","score":7,"evidence":["src/smoke.sh#coach-chatbox","docs/feature-audit-2026-08-24.md#ai-operations-qa"],"blocker":"Waitlist and attendance reads are not fully live and there is no organization scope.","confidence":"medium"},{"id":8,"feature":"AI voice calibration","domain":"AI Assistant","classification":"spec_only","score":2,"evidence":["docs/feature-audit-2026-08-24.md#ai-voice-calibration"],"blocker":"A voice transcript is not persisted as a reusable drafting-tone profile.","confidence":"medium"},{"id":9,"feature":"AI onboarding concierge","domain":"AI Assistant","classification":"implemented_unverified","score":4,"evidence":["src/mod-coachonboard.js","docs/feature-audit-2026-08-24.md#ai-onboarding-concierge"],"blocker":"There is no durable onboarding state or grounded what-remains tool.","confidence":"medium"},{"id":10,"feature":"AI reorder lists","domain":"AI Assistant","classification":"absent","score":1,"evidence":["docs/feature-audit-2026-08-24.md#ai-reorder-lists"],"blocker":"There is no inventory model or stock truth for the AI to read.","confidence":"high"},{"id":11,"feature":"AI review responses","domain":"AI Assistant","classification":"spec_only","score":2,"evidence":["src/mod-reviews.js","docs/feature-audit-2026-08-24.md#ai-review-responses"],"blocker":"The AI has no owned review identifier or draft_review_reply writer.","confidence":"high"},{"id":12,"feature":"AI translation layer","domain":"AI Assistant","classification":"absent","score":1,"evidence":["docs/feature-audit-2026-08-24.md#ai-translation-layer"],"blocker":"There is no locale-aware translation pipeline or view-original state.","confidence":"high"},{"id":13,"feature":"Coach↔parent direct messaging","domain":"Messaging & Communication","classification":"implemented_unverified","score":7,"evidence":["src/smoke.sh#coach-messaging","src/mod-coachaccount.js#sendParentMessage","docs/feature-audit-2026-08-24.md#direct-messaging"],"blocker":"Web inbox reads and compose still split between real and local paths.","confidence":"medium"},{"id":14,"feature":"Group / broadcast messaging","domain":"Messaging & Communication","classification":"demo_only","score":3,"evidence":["src/mod-coachops.js","docs/feature-audit-2026-08-24.md#group-broadcast-messaging"],"blocker":"There is no live group membership and delivery model on web.","confidence":"high"},{"id":15,"feature":"AI-drafted messages","domain":"Messaging & Communication","classification":"implemented_unverified","score":7,"evidence":["src/smoke.sh#assistant-dispatch","docs/feature-audit-2026-08-24.md#ai-drafted-messages"],"blocker":"Bulk and scheduled delivery remain incomplete and some deploy state is unknown.","confidence":"medium"},{"id":16,"feature":"Parent session updates / recaps","domain":"Messaging & Communication","classification":"blocked","score":4,"evidence":["docs/security/RED-2026-08-25-parent-update-binding.md","src/mod-notes.js"],"blocker":"The server path does not prove that the targeted child was coached by the provider.","confidence":"high"},{"id":17,"feature":"Two-deep / COPPA-safe structure","domain":"Messaging & Communication","classification":"implemented_unverified","score":5,"evidence":["src/mod-booking.js","docs/feature-audit-2026-08-24.md#two-deep-coppa"],"blocker":"Guardian isolation exists, but two-deep participation or immutable witnessing is not enforced.","confidence":"medium"},{"id":18,"feature":"Message notifications (push/email)","domain":"Messaging & Communication","classification":"implemented_unverified","score":4,"evidence":["docs/feature-audit-2026-08-24.md#message-notifications","docs/coach-portal-spec.md#messaging-inbox"],"blocker":"Push credentials and real-device delivery are unverified and email fallback is absent.","confidence":"medium"},{"id":19,"feature":"Automated / scheduled messages","domain":"Messaging & Communication","classification":"implemented_unverified","score":6,"evidence":["src/smoke.sh#approvals","src/mod-coachops.js"],"blocker":"The approval lifecycle exists, but there is no general recurring scheduler or quiet-hours proof.","confidence":"medium"},{"id":20,"feature":"Shared team inbox (org routing)","domain":"Messaging & Communication","classification":"spec_only","score":3,"evidence":["docs/enterprise-roadmap.md#communication-accountability","docs/clo-brain.md#backend-supabase"],"blocker":"The shared inbox schema is authored but not applied.","confidence":"high"},{"i